<?xml version="1.0" encoding="UTF-8"?>

<!ELEMENT descripcion (#PCDATA)>
<!ELEMENT dia (#PCDATA)>
<!ELEMENT mes (#PCDATA)>
<!ELEMENT anyo (#PCDATA)>
<!ELEMENT fecha (dia,mes,anyo)>
<!ELEMENT hechoshistoricos (descripcion, fecha)>
<!ELEMENT hechos (hechoshistoricos*)>
